{
    "scorer_version": "H1.1",
    "corpus_version": "C1.0",
    "case_results": {
        "woo_title_01": {
            "findings": [
                {
                    "code": "leakage_not_applicable",
                    "severity": "info",
                    "message": "Scaffolding leakage checks are not applicable (marker evidence unavailable).",
                    "data": [],
                    "applicability": "not_applicable"
                }
            ],
            "critical_count": 0,
            "error_count": 0,
            "warning_count": 0,
            "not_applicable_count": 1,
            "pass": true
        },
        "woo_title_02": {
            "findings": [
                {
                    "code": "leakage_not_applicable",
                    "severity": "info",
                    "message": "Scaffolding leakage checks are not applicable (marker evidence unavailable).",
                    "data": [],
                    "applicability": "not_applicable"
                }
            ],
            "critical_count": 0,
            "error_count": 0,
            "warning_count": 0,
            "not_applicable_count": 1,
            "pass": true
        },
        "woo_title_03": {
            "findings": [
                {
                    "code": "leakage_not_applicable",
                    "severity": "info",
                    "message": "Scaffolding leakage checks are not applicable (marker evidence unavailable).",
                    "data": [],
                    "applicability": "not_applicable"
                }
            ],
            "critical_count": 0,
            "error_count": 0,
            "warning_count": 0,
            "not_applicable_count": 1,
            "pass": true
        },
        "woo_title_04": {
            "findings": [
                {
                    "code": "leakage_not_applicable",
                    "severity": "info",
                    "message": "Scaffolding leakage checks are not applicable (marker evidence unavailable).",
                    "data": [],
                    "applicability": "not_applicable"
                }
            ],
            "critical_count": 0,
            "error_count": 0,
            "warning_count": 0,
            "not_applicable_count": 1,
            "pass": true
        },
        "woo_title_05": {
            "findings": [
                {
                    "code": "leakage_not_applicable",
                    "severity": "info",
                    "message": "Scaffolding leakage checks are not applicable (marker evidence unavailable).",
                    "data": [],
                    "applicability": "not_applicable"
                }
            ],
            "critical_count": 0,
            "error_count": 0,
            "warning_count": 0,
            "not_applicable_count": 1,
            "pass": true
        },
        "woo_title_06": {
            "findings": [
                {
                    "code": "leakage_not_applicable",
                    "severity": "info",
                    "message": "Scaffolding leakage checks are not applicable (marker evidence unavailable).",
                    "data": [],
                    "applicability": "not_applicable"
                }
            ],
            "critical_count": 0,
            "error_count": 0,
            "warning_count": 0,
            "not_applicable_count": 1,
            "pass": true
        },
        "woo_short_01": {
            "findings": [
                {
                    "code": "leakage_not_applicable",
                    "severity": "info",
                    "message": "Scaffolding leakage checks are not applicable (marker evidence unavailable).",
                    "data": [],
                    "applicability": "not_applicable"
                }
            ],
            "critical_count": 0,
            "error_count": 0,
            "warning_count": 0,
            "not_applicable_count": 1,
            "pass": true
        },
        "woo_short_02": {
            "findings": [
                {
                    "code": "leakage_not_applicable",
                    "severity": "info",
                    "message": "Scaffolding leakage checks are not applicable (marker evidence unavailable).",
                    "data": [],
                    "applicability": "not_applicable"
                }
            ],
            "critical_count": 0,
            "error_count": 0,
            "warning_count": 0,
            "not_applicable_count": 1,
            "pass": true
        },
        "woo_short_03": {
            "findings": [
                {
                    "code": "leakage_not_applicable",
                    "severity": "info",
                    "message": "Scaffolding leakage checks are not applicable (marker evidence unavailable).",
                    "data": [],
                    "applicability": "not_applicable"
                }
            ],
            "critical_count": 0,
            "error_count": 0,
            "warning_count": 0,
            "not_applicable_count": 1,
            "pass": true
        },
        "woo_short_04": {
            "findings": [
                {
                    "code": "leakage_not_applicable",
                    "severity": "info",
                    "message": "Scaffolding leakage checks are not applicable (marker evidence unavailable).",
                    "data": [],
                    "applicability": "not_applicable"
                }
            ],
            "critical_count": 0,
            "error_count": 0,
            "warning_count": 0,
            "not_applicable_count": 1,
            "pass": true
        },
        "woo_short_05": {
            "findings": [
                {
                    "code": "leakage_not_applicable",
                    "severity": "info",
                    "message": "Scaffolding leakage checks are not applicable (marker evidence unavailable).",
                    "data": [],
                    "applicability": "not_applicable"
                }
            ],
            "critical_count": 0,
            "error_count": 0,
            "warning_count": 0,
            "not_applicable_count": 1,
            "pass": true
        },
        "woo_short_06": {
            "findings": [
                {
                    "code": "leakage_not_applicable",
                    "severity": "info",
                    "message": "Scaffolding leakage checks are not applicable (marker evidence unavailable).",
                    "data": [],
                    "applicability": "not_applicable"
                }
            ],
            "critical_count": 0,
            "error_count": 0,
            "warning_count": 0,
            "not_applicable_count": 1,
            "pass": true
        },
        "woo_long_01": {
            "findings": [
                {
                    "code": "leakage_not_applicable",
                    "severity": "info",
                    "message": "Scaffolding leakage checks are not applicable (marker evidence unavailable).",
                    "data": [],
                    "applicability": "not_applicable"
                }
            ],
            "critical_count": 0,
            "error_count": 0,
            "warning_count": 0,
            "not_applicable_count": 1,
            "pass": true
        },
        "woo_long_02": {
            "findings": [
                {
                    "code": "leakage_not_applicable",
                    "severity": "info",
                    "message": "Scaffolding leakage checks are not applicable (marker evidence unavailable).",
                    "data": [],
                    "applicability": "not_applicable"
                }
            ],
            "critical_count": 0,
            "error_count": 0,
            "warning_count": 0,
            "not_applicable_count": 1,
            "pass": true
        },
        "woo_long_03": {
            "findings": [
                {
                    "code": "leakage_not_applicable",
                    "severity": "info",
                    "message": "Scaffolding leakage checks are not applicable (marker evidence unavailable).",
                    "data": [],
                    "applicability": "not_applicable"
                }
            ],
            "critical_count": 0,
            "error_count": 0,
            "warning_count": 0,
            "not_applicable_count": 1,
            "pass": true
        },
        "woo_long_04": {
            "findings": [
                {
                    "code": "leakage_not_applicable",
                    "severity": "info",
                    "message": "Scaffolding leakage checks are not applicable (marker evidence unavailable).",
                    "data": [],
                    "applicability": "not_applicable"
                }
            ],
            "critical_count": 0,
            "error_count": 0,
            "warning_count": 0,
            "not_applicable_count": 1,
            "pass": true
        },
        "woo_long_05": {
            "findings": [
                {
                    "code": "leakage_not_applicable",
                    "severity": "info",
                    "message": "Scaffolding leakage checks are not applicable (marker evidence unavailable).",
                    "data": [],
                    "applicability": "not_applicable"
                }
            ],
            "critical_count": 0,
            "error_count": 0,
            "warning_count": 0,
            "not_applicable_count": 1,
            "pass": true
        },
        "woo_long_06": {
            "findings": [
                {
                    "code": "leakage_not_applicable",
                    "severity": "info",
                    "message": "Scaffolding leakage checks are not applicable (marker evidence unavailable).",
                    "data": [],